Filename,Transcription
conversation_2018.wav," Hey, can you tell me Blake's address?  Carlos wanted me to meet him there but I got lost and he's not answering his phone."
conversation_2019.wav, Can I get your opinion on something first?
conversation_202.wav, I'm sorry. I've joined the League of People that don't keep in touch.  You mean a great deal to me. You have been a friend at all times even at great personal  cost. Do have a great week.
conversation_2020.wav, That one week leave I put no that time.  Why?
conversation_2021.wav," If we hit it off, you can move in with me, smiley face."
conversation_2022.wav," Excellent. I spent and LT, hashtag NGT, years in the Air Force.  Iraq and Afghanistan. I am stable and honest. Do you like traveling?"
conversation_2023.wav, I want to watch that movie.
conversation_2024.wav," Okay, Lord Thanks. You and school."
conversation_2025.wav, I'm in class.  Did you get my text?
conversation_2026.wav," The bus leaves at NLT, hashtag NGT."
conversation_2027.wav," God Bless.Get Good Sleep My Dear, I Will Pray."
conversation_2029.wav, Do have a nice day today. I love you so dearly.
conversation_203.wav," Hi finally, I completed the course."
conversation_2030.wav, AOA bit pi s e h you know.  Scared he done ram who I am then die.  He...  But he become better looking orty lit.
conversation_2031.wav, I'll ask a few of my roommates.
conversation_2032.wav," Now, what's your house hashtag again?  And do you have any beer there?"
conversation_2033.wav, Do you all want to meet up and combine all the parts?  How's the rest of the project going?
conversation_2034.wav, Getting tickets for Walsal Tuesday 6th March.  My mate is getting me them on Saturday. You'll pay my treat.  Want to go?  TextBock.Terry.
conversation_2035.wav," Yes, we are chatting too."
conversation_2036.wav," Hi, it's Jess. I don't know if you are at work, but call me when you can I am at home. I'll leave.  Triple X"
conversation_2037.wav, She-on.  After meeting supervisor God worked too du-li-o.  You working now.
conversation_2038.wav, Are you going to write an exam this week?
conversation_2039.wav," Well, I will watch Shrek and 3D.  B."
conversation_204.wav, It will stop on itself.  I however suggest she stays with someone that will be able to give wars for every
conversation_2040.wav, Am I that much dirty fellow?
conversation_2041.wav," Do know that's what he told me.  Okay, Laura."
conversation_2042.wav," I'll probably be by tomorrow, or even later tonight if something's going on."
conversation_2043.wav, I couldn't say no as he is a dying man and I feel sad for him so I will go and I just wanted you to know I would probably be gone late into your night.
conversation_2044.wav, If you're thinking of lifting me one then no.
conversation_2045.wav, same as you. Done one. Why you done like me already? What are you doing now? Still eating.
conversation_2046.wav, Send me your email ID soon.
conversation_2047.wav," What makes some people dearer is not just a happiness debt you feel when you meet them, but the pain you feel when you miss them."
conversation_2048.wav," Dude. What's up? How to Risa? Hope you have been okay. When I didn't hear from  these people, I called them and they had received the package since deck and LT, hashtag  NGT. Just thought you LT like to know. Do have a fantastic ear and all the best with your reading.  Plus if you can really really bam first aid for Osmo, then your work is done."
conversation_2049.wav, Hey gorgeous man. My workmobile number is. Have a good one babe.  Squishy Vloss.
conversation_205.wav, How are you doing?  Hope you've settled in for the new school year.  Just wishing you a great day.
conversation_2050.wav, May I call you later PLS.
conversation_2052.wav, That's the way you should stay up.
conversation_2053.wav," Hello, thanks for taking that call. I got a job.  Starts on Monday."
conversation_2054.wav, What time is your flight TMR?
conversation_2055.wav, When should I come over?
conversation_2056.wav, I have a rather prominent bite mark on my right cheek.
conversation_2057.wav, Asterisk will be September by then.
conversation_2058.wav, Are you wet right now?
conversation_2059.wav, and how's your husband.
conversation_206.wav, Good morning dear HAB and nice day.
conversation_2060.wav," Are we doing the norm tomorrow?  I finished just a 4.15 cost of ST tests.  Need to sort library stuff out at some point tomo, got letter from today, access till  end March so I better get move on."
conversation_2061.wav," Yeah, I got a list with only you and Joanna if I'm feeling really anti-social."
conversation_2062.wav, I am in your office N.A.
conversation_2063.wav, Are you coming down later?
conversation_2064.wav, Superday Good Replacement for Morley.
conversation_2065.wav, That is goodgoodplayer.yhe is unsolved.
conversation_2066.wav, Hi. Do you want to join me with STS later?  Meeting them at 5. Call you after class.
conversation_2067.wav, It's on an engulfed.  But Tele has decided it won't let me watch it and Mia and Elliot work hissing.  Dammit?
conversation_2069.wav, I don't want to hear philosophy.  Just say what happened.
conversation_207.wav, Did you got that person story?
conversation_2070.wav, You got job in Wipro you will get everything in life in two or three years.
conversation_2071.wav, Then can't get the laptop.  My metric card with U-lay.
conversation_2072.wav, The note in next showf6 is 850.  Toa Payo got 650.
conversation_2074.wav, I just made some payments so don't have that much.  Sorry.  Would you want it FedEx or the other way?
conversation_2075.wav," They did T play one day last year, no even though they have very good team.  Like India."
conversation_2076.wav," K, you are the only girl waiting in reception."
conversation_2077.wav," Say this slowly.  God, I love you and Amp, I need you clean my heart with your blood dots and this to  ten special people and Amp, you see miracle tomorrow, do a PLS-PLS do it."
conversation_2078.wav, I hate when she does this.  She turns what should be a fun shopping trip into an annoying day of how everything would  look in her house.
conversation_2079.wav," Sir, I am waiting for your call."
conversation_208.wav," Is your hamster dead?  Hey, so tomorrow I meet you at 1pm Orchard MRT."
conversation_2080.wav, What's up? Do you want me to come online?
conversation_2081.wav," It could work, we'll reach a consensus at the next meeting."
conversation_2082.wav," Hey, y'all then I wait, Laura. Then you entertain me.  He..."
conversation_2083.wav," The last thing I ever wanted to do was hurt you, and I didn't think it would have.  You'd laugh, be embarrassed, delete the tag and keep going.  But as far as I knew, it wasn't even up.  The fact that you even felt like I would do it to hurt you shows you really don't know me  at all.  It was messy Wednesday, but it wasn't bad.  The problem I have with it is you have the time to clean it, but you choose not to.  You Skype, you take pictures, you sleep, you want to go out.  I don't mind a few things here and there, but when you don't make the bed, when  you throw laundry on top of it, when I can't have a friend in the house because I'm embarrassed  that there's underwear and brush strewn on the bed, pillows on the floor, that's something else.  You used to be good about at least making the bed."
conversation_2084.wav, I'll let you know when it kicks in.
conversation_2085.wav," You call him now, okay? I said call him."
conversation_2086.wav," Call to the number which is available in appointment, and ask to connect the call to Wahid Fatima."
conversation_2087.wav," Or you go by with him then I meet you later, can?"
conversation_2088.wav, mm mm. Fuck. Not fair. You know my weaknesses. Grins pushes you to your knees  exposes my belly and pulls your head to it don't forget. I know yours too wicked smile.
conversation_2089.wav, Today my system SH get ready.all as well and I am also in the deep well.
conversation_209.wav," Hi, it's Kate how is your evening?  I hope I can see you tomorrow for a bit but I have to bloody baby John Tett.  Text back if you can.  Smiley face."
conversation_2090.wav, Mom wants to know where you at.
conversation_2091.wav," Alright, I'll text you when I'm back."
conversation_2092.wav," Don't know supports S and S RT, I think.  I think PS3 can play through USB 2."
conversation_2093.wav," Okay, I didn't know what you meant.  Yep, I am Baby Hondon."
conversation_2096.wav," Watching TV now. I got new job, smiley face."
conversation_2097.wav, This pent thing is beyond a joke.  Want a bureau do?  Don't do a masters as can't do this ever again.
conversation_2098.wav, I am Ed Apparty with Alex Nichols.
conversation_21.wav, I'm gonna say no. Sorry. I would but as normal I'm starting to panic about time.  Sorry again. Are you seeing on Tuesday?
conversation_210.wav," Founded, ENC and LT, hashtag NGT, where you at."
conversation_2100.wav, Just seeing your miss call my dear brother.  Do have a GRA day.
conversation_2101.wav," Okay, you finishing soon."
conversation_2102.wav," Sorry, I can't help you on this."
conversation_2103.wav," Come to me, slave. You're doing it again.  Going into your shell and unconsciously avoiding me.  You are making me unhappy, sad face."
conversation_2104.wav, I love your S. Do you enjoy doggy style?  Smiley face.
conversation_2105.wav, I think asking for a gym is the excuse for lazy people.  I jog.
conversation_2108.wav, No. On the way home. So if not for the long dry spell the season would have been over.
conversation_2109.wav, I got a collector car at 6-lay.
conversation_211.wav," I sent you and LT, hashtag and gt, box."
conversation_2110.wav, Okay but knackered. Just came home and went to sleep. Not good at this full-time work  WorkLark.
conversation_2111.wav, Probably earlier than that if the stations where I think it is.
conversation_2113.wav," Good morning, please call me, sir."
conversation_2115.wav," Ah, heads up we don't have that much left."
conversation_2116.wav, I taught you outside cost-air and say you come shopping.  Of course we nice what.  We juice when Simlim look at MP3 player.
conversation_2117.wav," I'd, sounds good.  When do you want me to come down?"
conversation_2118.wav, What would you like for your birthday?
conversation_2119.wav," I love working from home, smiley face."
conversation_212.wav," Hello Darlin, I have finished college now so text me when you finish if you can love K-TrubleX."
conversation_2120.wav, and misvide the parachute and double coins.  You must not know me very well.
conversation_2121.wav," Sorry, I'll call later."
conversation_2122.wav, My sister got placed in Burlassofta.
conversation_2124.wav," What? Okay, okay. Let's make use of e unlimited.  Ha ha."
conversation_2125.wav," There are some people by mu, I'm at the table by Lambda."
conversation_2126.wav, and stop being an old man.  You get to build snowman snow angels and snow ball fights.
conversation_2127.wav," Hello, baby you okay?"
conversation_2128.wav, Hello beautiful are you okay?  I've kind of add a row with and he walked out the pub.  I wanted a night with you miss you.
conversation_2129.wav, Then you're going Ikea STRF debt.
conversation_213.wav," Your account has been refilled successfully by INR and LT, Decimal and GT.  Your carolous circle prepaid account balance is R's and LT, Decimal and GT.  Your transaction ID is KR and LT, hashtag and GT."
conversation_2130.wav," Because it's end-lt, hashtag ngt, Jan went out the post-of-ice is in holiday so she see and go fr the post-of-ice, got it duffer."
conversation_2131.wav," L-O-L-Gur, my mom is taking forever with my prescription.  Pharmacy is like two minutes away.  O-G."
conversation_2132.wav," For real though this sucks, I can't even cook my whole electricity is out, and I'm hungry."
conversation_2133.wav, You want to go.
conversation_2134.wav, It's not that time of the month nor mid of the time.
conversation_2135.wav, FFFFFFF  Can you text cademe or are you too far gone?
conversation_2136.wav," We're not leaving yet.  OK, Laura, then we go elsewhere, any.  You think."
conversation_2137.wav, Is Fujitsu a series life book good?
conversation_2138.wav," You're I wanted to scold you, yes, but late already.  I wear got Joan S.E.C.ing you.  If you ask me before he ask me, then I'll go out WU all lower.  And you still can act so real."
conversation_2139.wav, Don't know you bring some food.
conversation_214.wav, Good morning sleeping ram.
conversation_2140.wav, No current and food here. I am alone also.
conversation_2141.wav, I'll be an SCHFR-426.  I don't have to book an SCH.  It's at home.
conversation_2142.wav, Hello. They are going to the village pub at 8 so either come here or they're accordingly.  Okay.
conversation_2143.wav, Okay.
conversation_2144.wav," We don't call like an LT, hashtag and gt, time's up.  No give us high potential though."
conversation_2145.wav," Don't give a monkey's what they think and I certainly don't mind.  Any friend of mine and all that.  Just don't sleep with, that would be annoying."
conversation_2146.wav," OMG, it could snow here tonight."
conversation_2147.wav, Carry on not disturbing both of you.
conversation_2148.wav, What part tell me? I went to Beth.
conversation_2149.wav, Jews finished Avadar Negro.
conversation_215.wav, You call me Alder at 11 o'clock.
conversation_2150.wav, Are you overscratching it?
conversation_2151.wav, Hope you are having a great day.
conversation_2152.wav, Did either of you have any ideas?  Do you know of any place doing something?
conversation_2153.wav," My planning usually stops at FIND HELLOWEAD, Smoke HELLOWEAD."
conversation_2154.wav," The fact that your cleaning shows you know why I'm upset.  Your priority is constantly what I want to do, not what I need to do."
conversation_2155.wav, Excellent. Are you ready to moan and scream in ecstasy?
conversation_2157.wav," Okay, okay, why can't you come here and search job?"
conversation_2158.wav," I got lousy sleep.  I kept waking up every two hours to see if my cat wanted to come in.  I worry about him when it's cold, sad face."
conversation_2159.wav," Yeah, I'll leave in a couple minutes and amp, let you know when I get to you."
conversation_216.wav, You say until like that I done by Ericsson OSO cannot already lar.
conversation_2160.wav, Can you call me a 1010 to make sure that I've woken up?
conversation_2161.wav," Hey, we can go jazz power. You'll get hip hop, KB, and you'll get sun up."
conversation_2162.wav, The battery is for MR at Wally My Uncle.  A.K.A. Eggbun.
conversation_2163.wav, I can't pick the phone right now.  PLS and a message.
conversation_2164.wav, Wait two minutes. Stand at bus stop.
conversation_2165.wav," Oh, I see. I thought you meant Mary Jane."
conversation_2166.wav," Uh-huh, really? Oh no, how? Then will they deduct your lesson TMR?"
conversation_2167.wav, Now I'm going to the works with JWODBOWDU.
conversation_2168.wav, then just eat a shit and wait for your monkey face bitch.  U.S. Hole.
conversation_2169.wav, Good night.  A.M. going to sleep.
conversation_217.wav," As I entered my cabin my B.A. said, happy birthday boss.  I felt special.  She asked me for lunch.  After lunch she invited me to her apartment.  We went there."
conversation_2170.wav," I'll grab something to eat too, text me when you're back at me."
conversation_2171.wav," Okay, okay, why can't you come here and search job?"
conversation_2172.wav, Take something for pain.  If it moves however to any side in the next 6HRSE adapter.
conversation_2173.wav," LOL.  Oh no babe, I won't be sliding into your place after midnight, but thanks for the invite."
conversation_2174.wav, How's that person's story?
conversation_2175.wav, L-O-L that would be awesome payback.
conversation_2176.wav," Yes, it completely and out of form Clark also utter waste."
conversation_2177.wav," Honeybee said, I'm the sweetest indie world god laughed and amp, said, wait you haven't met  D person reading this message moral, even god can crack jokes.  GM plus GM plus GE plus GM."
conversation_2178.wav, Thanks. It was only from Tesco's but quite nice.  All gone now.  Speak soon.
conversation_2179.wav, What's a feathery bow? Is that something guys have that I don't know about?
conversation_218.wav," Atyo, that's straight dog."
conversation_2180.wav," Even I can't close my eyes you are in me or Vava playing Emma, laughing face."
conversation_2181.wav, to laptop. I know in for but too slow lar. I want fast one.
conversation_2183.wav, NVM is okay.
conversation_2184.wav, Enjoy your life. Good night.
conversation_2185.wav," Yes, but can we meet in town costs will go to Jep and then home?  You could text at bus stop.  And don't worry we'll have finished by March, Ish."
conversation_2186.wav, I had asked you a question some hours before. It's answer.
conversation_2187.wav, That's cool. Where should I come? On you or in you?  Smiley face.
conversation_2188.wav, Delhi and Chennai still silent.
conversation_2189.wav, L-O-L-Rite I was thinking that too H-H-H
conversation_219.wav," You please give us connection today itself before and LT, decimal and GT, or refund a bill."
conversation_2190.wav," No, I'm in the same boat.  Still here at my mom's.  Check me out on you.  I'm half naked."
conversation_2191.wav, S-H-H-H-H-H-Nobody is supposed to know.
conversation_2192.wav," Sorry, I'll call later."
conversation_2193.wav," Sorry, I'll call later in meeting anything related to trade, please call Arul.  And LT, hashtag and gt"
conversation_2194.wav," Hey, I will be late. I'm at AMK. Need to drink tea or coffee."
conversation_2195.wav, The length is the same but he top shorter and I got a fringe now.  I think I'm not going Leo.  Too lazy.  Don't want to distract you also.
conversation_2196.wav, S.N. The Numbercurc Dane
conversation_2197.wav, No calls messages miss calls.
conversation_2198.wav," Sorry, I'll call later."
conversation_2199.wav," The baskets get in full, so I might be by tonight."
conversation_220.wav," Both, I shoot big loads so get ready."
conversation_2200.wav," Hi Darlin, I've just got back and I had a really nice night and thanks so much for the  lift, see you tomorrow, Triple X."
conversation_2201.wav, No other Valentine's her. The proof is on your FB page.  A guy I'm so glad I really didn't watch your RuPaul show you tool.
conversation_2202.wav, and then set you book E.K.B. Leelha.
conversation_2203.wav, Have you been practicing your courtesy?
conversation_2204.wav, Shall I come to Get Pickle?
conversation_2205.wav," Hello, I was hoping for a laugh."
conversation_2206.wav," Yeah, I am deaf up for something SAT just got paid two day and I have been given a pound 50 pay rise for my work and have been made preschool coordinator too  I am feeling good love"
conversation_2207.wav," Well, I have to leave for my classmate.  You never came back to me, sad face, hope you have a nice sleep, my love."
conversation_2208.wav," LMAO, where's your fish memory when I need it?"
conversation_2209.wav, But I'll be going to SCH on Mon.  My sis need to take SMTH.
conversation_221.wav," What's up, Brove? Hope you had a great break.  Do have a rewarding semester."
conversation_2210.wav, Idea will soon get converted to live.
conversation_2211.wav," S, S, India going to draw the series after many years in South African soil."
conversation_2212.wav," Good morning, today I am late for end LT, decimal and GT, min."
conversation_2213.wav, Can't take any major roles in community outreach?  You rock Mel.
conversation_2214.wav," Shopping lore, then raining my hard to, leave orchard."
conversation_2215.wav, High here.  Have birthed at on the 2 at 8-pound 7-ounce's mother and baby doing brilliantly.
conversation_2216.wav, See the forwarding message for proof.
conversation_2217.wav," I can't keep going through this.  It was never my intention to run you out, but if you choose to do that rather than keep  the room clean so I don't have to say no to visitors, then maybe that's the best choice.  Yes, I wanted you to be embarrassed, so maybe you'd feel for once how I feel when I have  a friend who wants to drop by and I have to say no, as happened this morning.  I've tried everything.  I don't know what else to do."
conversation_2218.wav, I think mum lazy to go out.  I never ask her yet.
conversation_2219.wav," do whatever you want. You know what the rules are. We had to talk earlier this week about what  had to start happening, you showing responsibility. Yet, every week it's can I bend the rule this  way. What about that way? Do whatever. I'm tired of having the same argument with you every week.  N-A-N-L-T-H-Tag-N-G-T, movie doesn't end with the previews. You're still getting in after one."
conversation_222.wav, Home so we can always chat.
conversation_2220.wav, Emberth model I met you in our own DHA Mirage Remember.
conversation_2221.wav, Just reread it and I have no shame but tell me how he takes it and if he runs I will blame you forever.  Not really forever just a long time.
conversation_2222.wav," Princess, is your kitty-shaped or natural?"
conversation_2223.wav," Better than BB. If he won't use it, his wife will or them doctor."
conversation_2224.wav," Yeah, it came a while ago."
conversation_2225.wav," From tomorrow onwards, Eve 6 to 3 work."
conversation_2226.wav, Anything Lord Batoa Payo got placed to walk met.
conversation_2227.wav," I don't have anybody's number, I still haven't thought up a tactful way to ask Alex."
conversation_2228.wav, Is there any movie theater I can go to and watch unlimited movies and just pay once?
conversation_2229.wav, You having lunch alone? I now so bored.
conversation_223.wav," Okay, good. Study well."
conversation_2230.wav," Yes, obviously, but you are the expert and the potato head.  Speak soon."
conversation_2231.wav," No man, my car is meant to be crammed full of people."
conversation_2232.wav," No got new job at bar in airport on sets get in 4.47 per hour, but means no lion.  Keep in touch."
conversation_2233.wav, Callis is ready for bat in second innings.
conversation_2234.wav," Thanks, but my birthday is over already."
conversation_2235.wav," I can't you just apologize, admit you were wrong and ask me to take you back."
conversation_2236.wav," I know L.A. You want a P.B.F.O.S.O. Ride.  K-Lore, other days then."
conversation_2237.wav," Yes, I'm small kid.  And boost is the secret of my energy."
conversation_2238.wav, I am gonna miss you so much.
conversation_2239.wav, Is Avatar supposed to have subtitles?
conversation_224.wav, Yup. How you know that?
conversation_2240.wav, Simply sitting and watching Imagine Office.
conversation_2241.wav, You can jot down things you want to remember later.
conversation_2242.wav," Oh sorry, please, it's over."
conversation_2243.wav," Hey, are we going for the low lesson or gym?"
conversation_2244.wav," Don't pack what you can buy at anystore.like cereals.  If you must pack food, pack curry, or something non-Jay that you will miss."
conversation_2245.wav, You always make things bigger than they are.
conversation_2246.wav, You done want to watch infernal affair?
conversation_2247.wav," Me not waking up until 4 in the afternoon, sub."
conversation_2248.wav," I can send you a pick if you like, smiley face."
conversation_2249.wav," Okay, I booked all already. Including the one at Budgets."
conversation_225.wav, Sounds great. Are you home now?
conversation_2250.wav," I fuck it, I'll get it later."
conversation_2251.wav, Nota. But call me after some time.  He'll tell you K.
conversation_2252.wav, So don't use hookup anyhow.
conversation_2253.wav, How much is Blackberry Bowl 2 in Nigeria?
conversation_2254.wav," Hi, where are you? You and Home or Cali Cut."
conversation_2255.wav, Hey darlin! I can pick you up at college if you tell me when and where to empty.  Love Pete XX!
conversation_2256.wav," Oh, I was thin of going Yogasana at 10-Den no endie to go at 3-Den can rush to Parko 4-N-B.  Okie-Lore, you call me when ready."
conversation_2257.wav, Why so late but I need to go and get the laptop?
conversation_2258.wav," Sir, I am waiting for your mail."
conversation_2259.wav, .please charge my mobile when you get up in morning.
conversation_226.wav," Finally, the match heading towards draw as your prediction."
conversation_2260.wav," Nothing, I got message FRM that unknown no."
conversation_2261.wav," I'll fuck it, I'm re-sewing to Eve."
conversation_2262.wav, He didn't see his shadow.  We get an early springier.
conversation_2263.wav, I did.  One slice and one breadstick.  LOL.
conversation_2264.wav," Hey, I want you. I crave you. I miss you. I need you. I love you, Ahmed Saeed Al-Halik."
conversation_2265.wav, Is there any training tomorrow?
conversation_2267.wav," Pass this to all your contacts and see what you get.  Red, I'm in love with you blue, you put a smile on my face.  Purple, you are really hot.  Pink, you are so SWT.  Orange, I think I like you green, I really want to go out with you yellow, I W NT you back.  Black, I'm jealous of you brown, I miss you and W please give me one color."
conversation_2268.wav, Cast Daddy arranging time-see what time-fetch you are.
conversation_2269.wav," Then, you are L this no."
conversation_227.wav, Tired. I haven't slept well the past few nights.
conversation_2270.wav, Who's there say hi to our drug dealer?
conversation_2271.wav, It's hard to believe things like this.  All can say lie but think twice before saying anything to me.
conversation_2273.wav," Good night my dear. Sleep well and Amp, take care."
conversation_2274.wav, That is one of our Fool's Song.
conversation_2276.wav, You are lower actually we quite fast.  Cost a GE slow what?  Ha ha.
