Filename,Transcription
conversation_2277.wav, Must come later.  I normally bathe him into afternoon mop.
conversation_2278.wav," Trust me. Even if isn't there, it's there."
conversation_2279.wav," Hey Hun on bus go and do meet him. He wants to go out for a meal but I didn't feel like it  because I have to get last bus home, but he's sweetly life's ill."
conversation_228.wav, Easy art.  Send guards selected means it's good.
conversation_2280.wav, I can take you at like noon.
conversation_2281.wav, Where is it? Is there any opening for MCA?
conversation_2282.wav, I might. What's happening on your side?
conversation_2283.wav, I'm done already.
conversation_2284.wav," You are sweet as well, Princess.  Please tell me your likes and dislikes in bed."
conversation_2285.wav, How are you? Wish you a great semester.
conversation_2286.wav," Moji, I love you more than words.  Have a rich day."
conversation_2287.wav," Dude, how do you like the buff wind?"
conversation_2288.wav," Alright, babe, just thought I'd say away.  How you doing?  Nearly the end of me WKoftam never mind, we will have two hookups and if it went  M8.  Love Gen X"
conversation_229.wav, I have to take exam with March 3.
conversation_2290.wav," No, I'm not.  I can't give you everything you want and need.  You actually could do better for yourself on your own UVE got more money than I do.  I can't get work, I can't get a man, I can't pay the rent, I can't even fill my fucking  gas tank.  Yes, I'm stressed and depressed.  I didn't even call home for Thanksgiving cause I'll have to tell them I am up to nothing."
conversation_2291.wav, As call us won't play in 1st 2 ODI.
conversation_2292.wav, Then get some cash together and I'll text Jason.
conversation_2293.wav," Oh, my love, it's so good to hear from you.  OMG, I missed you so much today.  I'm sorry you're having problems with the provider, but thank you for to me."
conversation_2296.wav, Probably want to pick up more.
conversation_2297.wav, I'm done.
conversation_2298.wav, Are you the cutest girl in the world or what?
conversation_2299.wav," No dice, art class 6 through 9, sad face, thanks though.  Any idea what time I should come tomorrow?"
conversation_230.wav," Yeah, you should. I think you can use your GTATM now to register.  Not sure, but if there's any way I can help let me know.  But when you do be sure you are ready."
conversation_2301.wav," Oh, how they're good, good.  Made an Encharmacharachiku."
conversation_2302.wav, I think 530 lore.  But the no can get tickets or not.  What you doing now.
conversation_2303.wav, Autary Lousy Auto-Correct.
conversation_2304.wav, It's aside to simulate the test.  It just gives you very tough questions to test your readiness.
conversation_2305.wav," Anyway, seriously hit me up when you're back because otherwise I have to light up with Armand and he always has shit and slash or is vomiting."
conversation_2306.wav, I fetch you and or you fetch.
conversation_2307.wav, Thank you. I like you as well.
conversation_2308.wav," And imagine after you've come home from that having to rub my feet, make me dinner and help me get ready for my date.  Are you sure you're ready for that kind of life?"
conversation_231.wav, Ok no problem. Take your time.
conversation_2310.wav," Laura said she can loan me and LT, hashtag and gt"
conversation_2311.wav, Do we have any spare power supplies?
conversation_2312.wav," You are he quite clever, but after many guesses lore.  He got asked me to bring, but I thank Darren not so willing to go.  A. Are they thankfully onus still not attached what?"
conversation_2314.wav," Yeah, don't go to bed, I'll be back before midnight."
conversation_2316.wav," Well, I wasn't available as I wash off knobbing with last night's so they had to ask Nicky Plad instead of me."
conversation_2317.wav," It's that time of the week again, Ryan."
conversation_2318.wav, wish you many many returns of the day.  Happy birthday Vicky.
conversation_232.wav," There is OS called Ubuntu which will run without installing in hard disk, you can use that  OS to copy the important files in system and give it to repair shop."
conversation_2320.wav, I hope you know I'm still mad at you.
conversation_2321.wav," ArcMy3G is spotty, anyway the only thing I remember from the research we did was that province  and sterling were the only problem free places we looked at."
conversation_2322.wav, In XAM Hallboy asked Girl tell me the starting term for this answer I can den manage on my own after a lot of hesitation and look in around silently she said it.  In the pun on Gale upon a den.
conversation_2323.wav, Do you know when the result?
conversation_2325.wav," Beautiful truth against gravity.  Read carefully, our heart feels light when someone is in it.  But it feels very heavy when someone leaves it.  Good night."
conversation_2326.wav," Sorry I'm getting up now, feel really bad totally rejected that kind of me thing."
conversation_2327.wav, You do got a shitload of diamonds though.
conversation_2328.wav, TCP L.S. Do me a favor.  PLS can pay my birthday wishes to my PLS D&T forget it.  Today is her birthday shejas.
conversation_2329.wav," Well, I'm going to be an undead."
conversation_233.wav," Sorry, I'll call later."
conversation_2330.wav, Mine here like all FR China then so noisy.
conversation_2331.wav," Later, I guess. I need to do MCAT study too."
conversation_2332.wav," S, from the training manual at show there is no tech process it's all about password reset and trouble shooting."
conversation_2334.wav," spoke with Uncle John today. He strongly feels that you need to sacrifice to keep me here.  He's going to call you. When he does, I beg you to just listen.  Don't make any promises or make it clear things are not easy.  And I need you to please let us work things out. As long as I keep expecting help,  my creativity will be stifled so PLS just keep him happy, no promises on your part."
conversation_2335.wav, If he started searching he will get job in few days.he have great potential and talent.
conversation_2336.wav," Carlos took a while, again, we leave in a minute."
conversation_2337.wav," Well done, and. Love you all."
conversation_2338.wav, then why you came to hostel.
conversation_2339.wav, Case still are you loving me?
conversation_234.wav," Life is more strict than teacher.  Because teacher teaches lesson and amp, then conducts exam, but life first conducts  exam and amp, then teaches lessons.  Happy Morning!"
conversation_2340.wav, But I just remembered I got to bathe my dog today.
conversation_2341.wav, After the drug she will be able to eat.
conversation_2342.wav, I'll right-took the morphing. Back in you.
conversation_2343.wav," You see the requirements, please."
conversation_2344.wav," You stay in out of trouble stranger.  Saw Dave the other day he assorted now, still with me bloke when you gunna get a girl  MR, or mum still thinks we will get two gethough."
conversation_2347.wav, So can collect your laptop.
conversation_2348.wav," Okay.  Can be later showing around 8 to 8 30 if you want plus CLD have drink before.  Would prefer not to spend money on Nosh if you don't mind, as doing that NXTWK."
conversation_2349.wav, I will once I get home.
conversation_235.wav," Dear Good Morning Now, Only I Am Up."
conversation_2350.wav, Why not?  Lil' Lil' Ok next time then.
conversation_2351.wav," The table's occupied, I'm waiting by the tree."
conversation_2352.wav," I surely don't forgot to come, I will always be in touch in with you."
conversation_2353.wav, High-kindly give us back our documents which we submitted for loan from stop-outie.
conversation_2354.wav, I don't have I shall buy one dear.
conversation_2355.wav," Oh God, I am happy to see your message after three days."
conversation_2356.wav, What year? And how many miles?
conversation_2357.wav, Hey Cutie. How goes it? Here in Wales it's kind of okay.  There is like hills and shit but I still haven't killed myself.
conversation_2358.wav," sad story of a man, last week was my birthday. My wife did anti-wish me. My parents forgot  and so did my kids. I went to work. Even my colleagues did not wish. As I entered my cabin  my be a said, happy birthday boss. I felt special. She asked me for lunch. After lunch she invited  me to her apartment. We went there. She said, do you mind if I go into the bedroom for a minute?  Okay, I said in a sexy mood. She came out five minutes later with a cake and my wife,  my parents, my kids, my friends and my colleagues. All screaming. Surprise. And I was waiting on the sofa.  Naked."
conversation_2359.wav, I think you should go the honesty road.  Call the bank tomorrow.  It's the tough decisions that make us great people.
conversation_236.wav," Get down in gunt-hippurum and walk to Crosscut Road.  Right side and LT, hashtag NGT, street road and turn at first right."
conversation_2361.wav, No.  It's not specialization.  Can work but it's slave labor.  We'll look for it this month's Shackaw's No Shaker a four-bigger.
conversation_2362.wav, Is she replying?  Has boy changed his phone number?
conversation_2363.wav," One, go to write message 2, put on dictionary mode 3, cover the screen with hand,  4, press and Lt, hash tag and gt, 5, gently remove or hand.  It's interesting."
conversation_2364.wav," Hi my darling, I'm on my way to London and we have just been smashed into by another driver.  And have a big dent.  I'm really missing you what have you been up to?  Triple X."
conversation_2365.wav," Nothing really, just making sure everybody's up to speed."
conversation_2366.wav, I'm not coming home for dinner.
conversation_2367.wav," Thank you. And by the way, I just lost."
conversation_2368.wav," Yes, dot he have good criticising mind."
conversation_2369.wav," THX, all will be well in a few months."
conversation_237.wav," Dear, we are going to our rubber place."
conversation_2371.wav, Can I please come up now? I am ientown.don't matter if we're going OUTL8 are just really need to do cd.  Please don't please don't ignore my calls. You know the tisv.important.com for tomorrow.
conversation_2372.wav, I want. So what's with the guys?
conversation_2373.wav, You can try it and never play it originally either.
conversation_2374.wav," Higher, had a good day.  Have you spoken to since the weekend?"
conversation_2375.wav," See, I thought it all through."
conversation_2376.wav, I'm at work. Please call.
conversation_2377.wav," Get ready to moan and scream, smiley face."
conversation_2378.wav," Okay, why you got job then what's up?"
conversation_2379.wav, I don't think so.  You don't need to be going out that late on a school night.  Especially when the one class you have is the one you missed last Wednesday and probably  failed a test in on Friday.
conversation_238.wav," Sorry battery died, yet I'm here."
conversation_2380.wav," and popping and LT, hashtag and gt, ibuprofence was no help."
conversation_2381.wav," Babe. How goes that day? What are you doing? Where are you? I sit my cappuccino and think of you,  my love. I send a kiss to you from across the sea."
conversation_2382.wav, Okay.
conversation_2383.wav, P.S. You know where a grown-up now right?
conversation_2384.wav," Chinatown got porridge, clay pot rice, yam cake, fish head behuun.  Either we eat cheap den go kaffae and talk or go NYDC or something."
conversation_2385.wav, I know a few people I can hit up and fuck to the S.
conversation_2386.wav, Purity of friendship between two is not about smiling after reading the forwarded messages about smiling just by seeing the name.  Good Evan.
conversation_2387.wav, So is there anything specific I should be doing with regards to Jacqueline or what because I don't know what the fuck?
conversation_2388.wav," Oh God, I'm Gunna Gugel nearby Clips now."
conversation_239.wav," Yes, your TV is always available in workplace."
conversation_2390.wav, You'll probably should have our 10 pages if I add figures.  You all got how many pages.
conversation_2391.wav," Oh, for God, I'm gonna start belly dancing in Mosley with 6.30 if you want to join me, they have a cafe too."
conversation_2392.wav, Thank you so much for the call. I appreciate your care.
conversation_2393.wav, Congrats.  Treatpending.I am not on mail for two days.we'll mail once through.respectmotherathome.checkmails.
conversation_2394.wav, I called but no one pick up e-phone.  I asked both of them already they said okay.
conversation_2395.wav, Hi my email address has changed now it is.
conversation_2396.wav," Valiable, Affectionate, Elovable, Eternal, Enable, Tearuthful, Iendomate,  Natural, Enemies, Happy Valentine's Day in Advance."
conversation_2397.wav," Not much, just some text in.  How about you?"
conversation_2398.wav, Bring it if you got it.
conversation_2399.wav, I'm in a movie. Call me for what.
conversation_240.wav," I have printed it out.  So end LT, hashtag and gt, come upstairs."
conversation_2400.wav, Not sure I have the stomach for it.
conversation_2401.wav," Haha, can. But I'm having dinner with my cousin."
conversation_2402.wav," A boy was late too home.  His father, power of friendship."
conversation_2403.wav," And my man Carlos is definitely coming by mute tonight, no excuses."
conversation_2404.wav, Soon you will have the real thing Princess.  Do I make you wet?  Smiley face.
conversation_2405.wav, Roger P. L. S. Do me a favor.  P. L. S. convey my birthday wishes to my aunt.  P. L. S.  Today is her birthday.
conversation_2406.wav," Ha ha, my legs and neck are killing me and my amigos are hoping to end the night with a burn,  think I could swing by in like an hour."
conversation_2408.wav, Usually the body takes care of it by making sure it doesn't progress.  Can we PLS continue this talk on Saturday?
conversation_241.wav, Or it'll be a little closer like at the bus stop on the same street.
conversation_2410.wav," I'm well, night night."
conversation_2411.wav, Just wanted to say holy shit you guys weren't kidding about this bud.
conversation_2412.wav," Just get in a bit already with my collages at the ammo, while trying to, anyway.  God erost in a minute lovely I shall enjoy that."
conversation_2413.wav," This is one of the days you have a billion classes, right?"
conversation_2414.wav," Good morning, today I am late for 2 hours.  Because of back pain."
conversation_2415.wav," Okay, then I'll let him know later and ask him call UTMR."
conversation_2416.wav," Probably I'm sorry to really FRM hard, I'm sorry."
conversation_2417.wav," Okay, I'm Vali King Art now.  Do you want me to buy anything go over house?"
conversation_2418.wav, Asterisk will have two more cartons off you and is very pleased with shelves.
conversation_2419.wav," Nice talking to you.  Please don't forget my picks, smiley face, I want to see all of you."
conversation_242.wav, Where are you?  When will you reach here?
conversation_2421.wav," But really quite funny, Lord What? Then you should have run shorter distance what?"
conversation_2422.wav, I notice you like looking in the shit mirror you're turning into a right freak.
conversation_2423.wav, Great. I was getting worried about you. Just know that a wonderful and caring person like you will have only the best in life.  Know that you are wonderful and God's love is yours.
conversation_2425.wav," I prefer my free days.  Tuesday, wed, Friday, OSO can.  You ask those work in lore."
conversation_2426.wav," Alright, Jot House, the revision going?  Carey's been doing a smidgen.  Anyway, you want to come over after college, XX."
conversation_2427.wav," If you have believe me, come to my home."
conversation_2428.wav," Okay, okay. Where did you take test?"
conversation_2429.wav, Those were my exact intentions.
conversation_243.wav," New theory, argument when's D situation, but loses the person.  So don't argue with your friends just.  Kick them and Amp, say, I'm always correct."
conversation_2430.wav," Ha-ha-ha, but no money let.  Later got to go for tuition.  Ha-ha and looking for empty slots for driving lessons."
conversation_2431.wav," Hey.  Thank we just go according to what we discussed yesterday's lore, except no KB on Sunday.  Cost there's anti much less and to go if we attend KB on Saturday."
conversation_2432.wav," K, when we're free come to my home and also tell Vicky I-H-A-V sent mail to him also.  Better come evening I-L-B free today after 6 p.m."
conversation_2433.wav, Nothing just getting MSGS by this name with different nose.
conversation_2434.wav," Good morning, please call me, sir."
conversation_2435.wav, What's your room number again?  Want to make sure I'm knocking on the right door?
conversation_2436.wav," Si.como no.  Listen to the Platte album quite GD and the new ear one which is hilarious also bought  brain dance a comp off stuff on AFXS, Able UHAB2 here it, CUSNXXXXX."
conversation_2437.wav, PLS tell Nelson that the BBs are no longer coming.  The money I was expecting aid coming.
conversation_2438.wav," Give her something to drink, if she takes it and doesn't vomit then you her temp might drop.  If she unmits however let me know."
conversation_2439.wav," Thank you sent the text to the home phone.  That can't display texts.  If you still want to send it, his number is."
conversation_244.wav, Tomero final hearing on my laptop case so I can't.
conversation_2440.wav," Every day I use to sleep after and LT, hashtag NGT, so only."
conversation_2441.wav," K, I'll call you when I'm close."
conversation_2442.wav, You buy newspapers already?
conversation_2443.wav, Nope with my sis lore.  F bathing my dog then I can bathe.  Looks like it's going to rain soon.
conversation_2444.wav, who I'm on my way to my mom's.  She's making tortillas soup.  Y'all.
conversation_2445.wav, No management puzzleies.
conversation_2446.wav, How did you find out in a way that didn't include all of these details?
conversation_2447.wav, Will you like to be spoiled?  Smileyface
conversation_2449.wav, I am getting threats from your sales executive chief as I raised complaint against him.  It's an official message.
conversation_245.wav," Please tell me, you want done SPORTSX."
conversation_2450.wav," Hope things went well at doctors, Winkyface, reminds me I still need to go.did you see  the little thing I left in the lounge?"
conversation_2451.wav, Then what release schedule will be LK on Sun?
conversation_2452.wav," Hello, I'll enjoy role playing much."
conversation_2453.wav," Okay, may watching TV too."
conversation_2454.wav," I just love this line, hurt me with the truth, I don't mind I will tolerot.bcs or my  someone.  But, never comfort me with a lagoon and i8 and sweet dreams."
conversation_2455.wav," Just check out, heading out to drop off my stuff now."
conversation_2456.wav, Here got lots of hairdresser F.Archina.
conversation_2457.wav," sad story of a man, last week was my birthday. My wife did anti-wishme. My parents forgot  and so did my kids. I went to work. Even my colleagues did not wish."
conversation_2458.wav," You'll call you evening, you'll some ideas."
conversation_246.wav," Okay. No, no, just chining on. That was meant to be signing, but that sounds better."
conversation_2460.wav, Did you show him and what did he say or could you not see him for dust?
conversation_2461.wav," It should take about NLT, hashtag and gt, min."
conversation_2462.wav, Okay. Now I am in bus. If I come soon I will come otherwise tomorrow.
conversation_2463.wav, I can't pick the phone right now.  PLS and a message.
conversation_2465.wav, Finish Leo. You.
conversation_2466.wav," Oh, I think I did too."
conversation_2467.wav, You know we watch it at leader.
conversation_2468.wav, Life spent with someone for a lifetime may be meaningless but a few moments spent with someone who really love you means more than life itself.
conversation_2469.wav," Ha ha awesome, I've been to for you a couple times. Who else coming?"
conversation_247.wav," Although I told you that I'm into big face watches now but I really like you watch you  gave because it's from you.  Thanks for everything that you have done today, I'm touched."
conversation_2470.wav, Cold. Don't be sad dear.
conversation_2471.wav, Think I could stop by in like an hour or so.  My room mates looking to stock up for a trip.
conversation_2472.wav, Is that on the telly?  No it's Portia Jones.
conversation_2473.wav," Love you, I love you, I love you a lot."
conversation_2474.wav, Hello. How are you? I'm bored.  Anywhere thought I'd get bored with the TV but I am.  Tell me something exciting has happened there.  Anything.  On easy face.
conversation_2475.wav," Um, bad news, High Park Plaza $700 Studio Taken, only left to address $m-dollar $900."
conversation_2476.wav," Sorry, I'll call later in meeting."
conversation_2477.wav, Are you coming back for dinner?
conversation_2478.wav," I HAB almost reached.  Call, I'm unable to connect you."
conversation_2479.wav, whom you waited for yesterday.
conversation_248.wav, You don't remember that old commercial.
conversation_2480.wav, I reach home safe and soundly out.
conversation_2481.wav," Very good. Yes, please."
conversation_2482.wav," Hi, we can't okay but journey terrible.  WK not good as have huge backlog of marking to do."
conversation_2483.wav, I have had two more letters from.  I will copy them for you cost one has a message for you.  Speak soon.
conversation_2484.wav," Alex knows a guy who sells mids, but he's down in South Tampa and I don't think I could set it up before like it."
conversation_2485.wav, Don't you have message offer.
conversation_2487.wav," Hey there babe, how you doing?  What you up to tonight love any ex."
conversation_2488.wav, Remind me how to get there and I shall do so.
conversation_2489.wav," Sadface, that's not be romantic."
conversation_249.wav, Too late. I said I have the website. I didn't I have or don't have the slippers.
conversation_2490.wav, Hello.  Damn this Christmas thing.  I think I have decided to keep this MP3 that doesn't work.
conversation_2492.wav," Hi Darlin, I am Miss and you hope you are having a good time.  When are you back and what time if you can give me a call at home?  Just XX."
conversation_2494.wav," Draw V-A, I don't think so."
conversation_2495.wav, Don't pick up D-call when something important is there to tell.  Hiroshi
conversation_2497.wav, Nothing comes to my mind.  You help me by hanger lore.  Or laptop not heavy.
conversation_2498.wav," and LT, hashtag and gt, that's all.  Guess that's easy enough."
conversation_2499.wav, We can make a baby in y'all though.
conversation_250.wav," I ask you to call him now, okay."
conversation_2500.wav," Should I tell my friend not to come around till like and healthy, hashtag and gt, ish?"
conversation_2501.wav," Friendship poem, dear Odir you are not near but I can hear don't get fear live with  cheer no more tear you are always my dear. Good and I ate."
conversation_2502.wav, Still in the area of the restaurant.  You'll try to come back soon.
conversation_2503.wav, I bet it'll work. Thanks.
conversation_2506.wav," I have two sleeping bags, one blanket, and paper and phone details.  Anything else?"
conversation_2509.wav, So what do you guys do?
conversation_251.wav, Call us won't bat in second innings.
conversation_2510.wav," Also, that chat was awesome, but don't make it regular unless you can see her in person."
conversation_2511.wav, That's significant but don't worry.
conversation_2512.wav, That's cause your old. I live to be high.
conversation_2513.wav, Wake TSE Peli or NACBSE ZI-A-G-C-K-O-Cutch-Nahemyl-Taz-N-G-Wone-E-H-H-H-M-S-S-T-I-Z-O-H-M-G-H-I.
conversation_2514.wav, on the way to office DA.
conversation_2515.wav, in which place do you want to?
conversation_2516.wav, This pain couldn't have come at a worse time.
conversation_2517.wav, Okay.
conversation_2518.wav, Should I be stalking you?
conversation_2519.wav," Sorry, dude. Don't know how I forgot. Even after Dan reminded me. Sorry. Hope you guys had fun."
conversation_252.wav," It did not work again, though.  OK, good night then.  I will fix and have it ready by the time you wake up.  You are very dearly missed have a good night's sleep."
conversation_2520.wav," Okay, Laura."
conversation_2521.wav, Apps Class Maria Live.
conversation_2522.wav," The Christmas story is peace.  The Christmas message is love.  The Christmas miracle is Jesus.  H.A.V. a blessed month ahead and amp, wish you Merry Christmas."
conversation_2524.wav, that day you asked about on on number. Why?
conversation_2525.wav, A.M. Surfing Online Store.  For offers do you want to buy anything.
conversation_2526.wav," Long Beach lore, expected.  You having dinner now."
conversation_2527.wav, at home by the way.
conversation_2528.wav, We are both fine. Thanks.
conversation_2529.wav, What happened to her tell the truth?
conversation_2530.wav, Do you like Italian food?
conversation_2531.wav, which is weird because I know I had it at one point.
conversation_2532.wav," All you must be nearly dead, well jazz is coming over to do some work and that while  take forever."
conversation_2533.wav," Tell your friends what you plan to do on Valentine's Day at NLT, URL and GT."
conversation_2534.wav," Alright, see you in a bit."
conversation_2535.wav, Cheers for the message is Octurious.  I've even been staring at my phone for an age deciding whether to text or not.
conversation_2536.wav, I will take care of financialproblem.I will help.
conversation_2537.wav, Tell dear what happened to you.  Why are you talking to me like an alien?
conversation_2539.wav," One, go to write message 2, put on dictionary mode 3, cover the screen with hand,  4, press and Lt, hash tag and gt, 5, gently remove or hand.  It's interesting."
conversation_254.wav, Ranjith Cald RPD Duraj and Deepak 5 minute hold.
