Filename,Transcription
conversation_2540.wav, Okay.
conversation_2541.wav," Hi, this is Yuju, can I meet you at 11TMR?"
conversation_2542.wav," It's possible D&T Live in NLT, Hashtag NGT, Century CMFRWD and Think Different."
conversation_2543.wav, but I didn't slept in afternoon.
conversation_2544.wav, That seems unnecessarily affectionate.
conversation_2545.wav, Your else I'll think of all sorts of funny things.
conversation_2546.wav, you will be in the place of that man.
conversation_2548.wav, That's cool. How was your day?
conversation_255.wav," When you are lovable became angry with you, do not take it seriously.  Because being angry is the most childish and true way of showing deep affection, care and love.  Kated Amanda. Have nice data."
conversation_2550.wav, Are we going with the end LT?  Hashtag and GT?  BUS!
conversation_2551.wav," Hello, my love. How went your day? Are you all right? I think of you, my sweet and  send a jolt to your heart to remind you. I love you. Can you hear it? I screamed at  across the sea for all the world to hear. Ahmed al-Hallock is loved, and owned, possessive passionate"
conversation_2552.wav, No. He joined today itself.
conversation_2553.wav," OK, same with me.  Well, thanks for the clarification."
conversation_2554.wav, I'll talk to the others and probably just come early tomorrow then.
conversation_2556.wav," Had the money issue way me down, but thanks to you, I can breathe easier now.  I.L.L. make sure you don't regret it? Thanks."
conversation_2557.wav, Hi. I'm sorry I missed your call. Can you PLS call back?
conversation_2558.wav, How are you doing?  Hope you've settled in for the new school year.  Just wish in U-A-G-R-A day.
conversation_256.wav, What are you doing? How are you?
conversation_2560.wav," Okay, then no need to tell me anything I am going to sleep good night."
conversation_2561.wav," Okay, try to do weak end course in combatory."
conversation_2562.wav, V-nice.  Off to Sheffield Tom 2 Air My Opinions on Categories 2B Use 2 Measure Ethnicity in Next Census.  Busy Transcribing.  Smiley Face.
conversation_2563.wav, If you are at home then come down within 5 minutes.
conversation_2564.wav," a boy loved a gal. He props BT she didn't mind. He GVLVL TTRS, BT her friends through THM.  Again D boy decided to approach D gal, DT time a truck was speeding towards D gal.  WN it was about to hit D girl D boy ran like hell and saved her.  She asked HWC and you run so fast. D boy replied boost is D secret of my energy and instantly  D girl shouted our energy and I lived happily to GTH are drinking boost everty moral of D story  HV3 MSGSD Good and I OLD."
conversation_2565.wav," That day you say you cut or hear at Perigon, is it called hear sense?  Do you know how much is a hear cut?"
conversation_2566.wav," Hmm, too many of them unfortunately.  Picks obviously aren't hotcakes.  It's kind of fun though."
conversation_2567.wav, Watching TV lore. Why she so funny we bluff her for what? Is it because she  think it's impossible between us?
conversation_2568.wav, No lay he never say.
conversation_2569.wav," Thanks for today.  You are a good mate, I think you are right, sorry.  As usual, one you cheered me up.  Love you FRA and YXXXXXXXXX."
conversation_257.wav," UPS which is three days also, and the shipping company that takes two weeks.  The other way is USPS which takes a week but when it gets to lag you may have to bribe  supposed to get your stuff."
conversation_2570.wav, I'm on my way home.  Went to change bat 4 my watch then go shop a bit lower.
conversation_2571.wav," Hi, Mobile No.  And LT, hashtag and GT, has added you in their contact list on www.folonSMS.com.  It's a great place to send free SMS to people for more visitfolonSMS.com."
conversation_2572.wav," Good evening sir, hope you are having a nice day.  I wanted to bring it to your notice that I have been late in paying rent for the past few months  and have had to pay a dollar and LT, hashtag and gt, charge.  I felt it would be in considerate of me to nag about something you give at great cost to yourself  and that's why I didn't speak up.  I however am in a recession and won't be able to pay the charge this month hence my skin  well ahead of months and.  Can you please help?  Thank you for everything."
conversation_2573.wav," If I let you do this, I want you in the House by 8am."
conversation_2574.wav, Best line said in love.  I will wait till the day I can forget you or the day you realize that you cannot forget me.  GM
conversation_2575.wav, I will reach before 10 morning.
conversation_2576.wav, Your pussy is perfect.
conversation_2577.wav," Sorry, I'll call later."
conversation_2579.wav," No message, no RESP, once what happened."
conversation_258.wav," I'm back, let me know when you're ready."
conversation_2580.wav," Also, where's the piece?"
conversation_2581.wav, Whiskey Brandy rumgen beer vodka scotch champagne 1K UDI Erisut Hina Vasthukhal
conversation_2582.wav," Boo! How's things? I'm back at home and a little board already, sad face."
conversation_2583.wav," First has she gained more than NLT, Hashtag NGT, KG since she took in.  Second has she done the blood sugar tests.  If she has N its okay and her blood pressure is within normal limits then no worries."
conversation_2584.wav, Pick your phone up now you dumb.
conversation_2585.wav," Thanks to Thunkham, I feel very, very happy dear.  I also miss you to."
conversation_2586.wav," Okidok. I'm at home, but not dress costlying around ill.  Speak to you later bout times and stuff."
conversation_2587.wav," I don't run away FRMU.  I walk slowly and amp, it kills me that you don't care enough to stop me."
conversation_2588.wav," Babe, I'm back. Come back to me."
conversation_2589.wav, while you told others you'd marry them.
conversation_259.wav, Don't necessarily expect it to be done before you get back though because I'm just now heading out.
conversation_2590.wav, Nish and tell me who are you.
conversation_2591.wav," Yo, yo, yo, be true to a sub."
conversation_2592.wav," Oh, okay, on sad right."
conversation_2593.wav, Hi. This is Roger from CL. How are you?
conversation_2595.wav," Oh, oh. Wasted.  Denmark's Coyoung Unset and Sun Liao."
conversation_2596.wav," Jesus Christ bitch, I'm trying to give you drugs, answer your fucking phone."
conversation_2597.wav, Please give it to or I will pick it up on Tuesday evening about hate if that is okay.
conversation_2598.wav, I'm meeting Darren.
conversation_2599.wav," One of Best Dialog and Cute Real Tonship.  When I die, don't come near my body.  God's my hands may not come to wipe our tears off that time.  Good and I ate."
conversation_260.wav, MMM so yummy babe. Nice jolt to the suzi.
conversation_2600.wav," Solve de case, a man was found murdered on end-l-t, decimal and g-t, and l-t, hashtag and g-t, afternoon.  One is wife called police.  Two police questioned everyone.  Three wife, Sir I was sleeping, when the murder took place.  Four dot cook, I was cooking.  Five dot gardener, I was picking vegetables.  Six dot house made, I went to depost office.  Seven dot children, we went to play.  Eight dot neighbor, we went to a marriage.  Police arrested demurder immediately.  Who's it?  Reply with reason, if you are brilliant."
conversation_2601.wav, Deer where you will be when I reach there.
conversation_2602.wav, All that's the first time you said you missed me without asking if I missed you first.  You do love me.  Smiley face.
conversation_2603.wav, Okay. Thanks.  GD-922.
conversation_2604.wav," Come to me right now, Ahmed."
conversation_2605.wav," L-O-L please do, actually send a pick of yourself right now.  I want to see, pose with a comb and hair dryer or something."
conversation_2606.wav, or was not into FPS then.
conversation_2607.wav, Who means computational science?  Why they like that one push your end there?
conversation_2608.wav," Could you not read me, my love? I answered you."
conversation_2609.wav, O. L. K. T. T. Then we take E. One T. T. Ants at Sinalore.  Dunwan Yogasana O. S. O. K.
conversation_261.wav, Where are you lover? I need you.
conversation_2610.wav, Madam regret disturbance.might receive a reference check from dlfprimoreca.kindlebeinform.rgdsrockish  carola
conversation_2611.wav, Oh I see. Then better quickly go bathe and settle down.
conversation_2612.wav, Here.  Cuddu.  I'm going to at 8 p.m.  I haven't got a way to contact him until then.
conversation_2613.wav, A blue blue blue I'll miss the first bowl.
conversation_2614.wav, LMAO but it's so fun.
conversation_2615.wav," Okay K-K, but he is not a big hit or dot anyway good."
conversation_2616.wav, Hey. I almost forgot. Happy B-day babe. I love ya.
conversation_2618.wav," Do you think I can move and LT, hashtag and gt, in a week?"
conversation_2619.wav, She.S find. I sent you an offline message to know how Angel is now.
conversation_2620.wav, How was texting and driving?
conversation_2621.wav, That's good.  Let's thank God.  Please complete the drug.  Have lots of water.  And have a beautiful day.
conversation_2622.wav," Really done, Bluff me, let.  You sleep early too.  Night."
conversation_2623.wav," Indians are poor but India is not a poor country.  Says one of the Swiss bank directors.  He says that end LT, hashtag NGT,  lack crore of Indian money is deposited in Swiss banks which can be used for taxless budget for  end LT, hashtag NGT, YRS.  Can give end LT, hashtag NGT, crore jobs to all Indians.  From any village to Delhi for, lane roads.  Forever free power subtly to more than end LT, hashtag NGT, social projects.  Every citizen can get monthly end LT, hashtag NGT, slash war end LT, hashtag NGT, YRS.  No need of World Bank and Amp, IMF loan.  Think how our money is blocked by rich politicians.  We have full rights against corrupt politicians.  Get in a forward caro keeper in the appathe.g.m."
conversation_2624.wav," Uncle Boy, I need movies, oh.  Guide me.  Plus, you know torrents are not particularly legal here.  And the system is slowing down.  What should I do?  Have a GR8 day.  Plus, have you started costs I don't meet you online?  How was the honeymoon?"
conversation_2625.wav," Oh yeah, yeah, I remember DA."
conversation_2626.wav, VTW regarding that we should really try to see if anyone else can be our fourth guy before we commit to a random dude.
conversation_2627.wav, I'm not busy just don't want to go so early.  He...
conversation_2628.wav," Russia. 11.48 it is then. Well, aren't we all up bright and early this morning?"
conversation_2629.wav, Great. I'm in church now. We'll hollow when I get out.
conversation_263.wav, I'm parked next to a mini.  When are you coming in today do you think?
conversation_2630.wav, Back in Brum. Thanks for putting us up and keeping us all unhappy. See you soon.
conversation_2631.wav, I don't know if they are scorable.
conversation_2632.wav," And LT, Hashtag and GT, Great Locksahachi Christmas Tree Burning Update, you can totally see stars here."
conversation_2633.wav," Yes, but I don't care. I need you bad, princess."
conversation_2634.wav," The guy, Kadeem, hasn't been selling since the break.  I know one other guy but he's paranoid as fuck and doesn't like selling without me there and I can't be up there till late tonight."
conversation_2635.wav," Sorry, I'll call later."
conversation_2636.wav, TMR then you bring lore.  A.O. later I come and see lore.  Maybe you never set properly you got to help sheet with you.
conversation_2637.wav," Do you know this note?  And LT, hashtag and GT."
conversation_2638.wav, Then she'd done believe what.
conversation_2639.wav, Take care back my thanks.
conversation_264.wav, Yup.
conversation_2640.wav, I know complain number only better directly go to bsnl off-&d apply for it.
conversation_2641.wav," Okay, I've seen it, so I should pick it on Friday."
conversation_2642.wav, How much she paid?  Saganya.
conversation_2643.wav, Left is heard. You want me to go SunTech look for you.
conversation_2644.wav," a big, make profit. But it's a start. Are you using it to get sponsors for the next event?"
conversation_2645.wav, on a Melopea normal then.
conversation_2646.wav," KK, how is your sister kids?"
conversation_2647.wav," Cool, I'll text you when I'm on the way."
conversation_2648.wav," Nope.  Meanwhile, she talks a make I greet you."
conversation_2649.wav, I can't talk to you now. I will call when I can. Don't keep calling.
conversation_265.wav," Anyway, I'm going shopping on my own now.  Because my sister not done yet.  Do not disturb you Leo."
conversation_2650.wav," Anything, Laura."
conversation_2651.wav," Rose needs water, season needs change, poep needs imagination my phone needs or SMS and I need  or lovely friendship forever."
conversation_2652.wav," good afternoon, babe. How goes that day? Any job prospects yet? I miss you, my love, size,  sad face."
conversation_2653.wav, They will pick up and drop in CAR.so no problem.
conversation_2654.wav, S.I. think he is waste for RR.
conversation_2655.wav, He is world-famous.
conversation_2656.wav, Is there coming Friday is leave for Pungle?  Do you get any news from your workplace?
conversation_2657.wav, L-O-L-L-L-L-L don't do it without me.  We could have a big sale together.
conversation_2658.wav, A.M. on my way.
conversation_2659.wav, He at Old Airport Road.  But now 630-ording.  God a lot of bull.
conversation_266.wav, Mino. In Luton 012-569-8789 ring me if you're around.
conversation_2660.wav," Surrey can't talk on phone, with parents."
conversation_2661.wav," OK, Laura, what time you finish?"
conversation_2662.wav," Princess, I like to make love and LT, hashtag and gt, times per night.  Hope that's not a problem."
conversation_2663.wav, MMI I am on the way to Railway.
conversation_2664.wav, I don't want to talk with you.
conversation_2665.wav," I'm done. I'm sorry. I hope your next space gives you everything you want. Remember  all the furniture is yours. If I'm not around when you move it, just lock all the locks  and leave the key with Jen."
conversation_2666.wav," Not yet.  Just I'd like to keep in touch and it will be the easiest way to do that from Barcelona.  By the way, how are you and how is the house?"
conversation_2667.wav, K do it at evening the urgent.
conversation_2668.wav, Pansy. You've been living in a jungle for two years.  It's my driving you should be more worried about.
conversation_2669.wav," MM have some congee, don't eat anything heavy, okay?"
conversation_2670.wav, Only if you promise you're getting out as soon as you can.  And you'll text me in the morning to let me know you made it in okay.
conversation_2671.wav, L-O-L that's different.  I don't go trying to find every real life photo you ever took.
conversation_2672.wav, I don't think it's a wrong calling between us.
conversation_2673.wav, KayildRink.PA then what doing?  I need SRS Model PLS send it to my mail ID pot.
conversation_2674.wav, AI-Rainlight quite big let.  If drizzling I can at least run home.
conversation_2675.wav," I have two docs appointments next week, Colin Slash.  I'm tired of them shoving stuff up me.  A guy couldn't I have had a normal body."
conversation_2676.wav," Don't be sad. It's over.  Don't thank ABT at all ready.  Concentrate on or other papers, K."
conversation_2677.wav, Greetings me. Consider yourself excused.
conversation_2678.wav, No drama PLS dot I have had enough from you and family while I am struggling in the hot  sun in a strange place dot no reason why there should be an ego of not going if not invited  when actually its necessity to go dot wait for very serious repercussions.
conversation_2679.wav, They released another Italian one-to-day and it has a cosine option.
conversation_268.wav, Why you did not come with us?
conversation_2680.wav," you at mu. You should try to figure out how much money everyone has for gas and alcohol,  Jay and I are trying to figure out our weed budget."
conversation_2682.wav," HCL Chenai requires freshers for voice process.excellentEnglish-needed.cellaryupto and LT,  hashtag NGT, dot call mishuman and LT, hashtag NGT, for telephonic interview via india rocks.com."
conversation_2683.wav, Die what this DA. Can I send my resume to this ID?
conversation_2684.wav," I know where the end LT, hashtag NGT, is, I'll be there around 5."
conversation_2685.wav, y'all by finish see you there.
conversation_2686.wav, Remember to ask Alex about his pizza.
conversation_2687.wav, No DA. Today also I forgot.
conversation_2688.wav," Ola would get back to you maybe not today but I've told him you can be his direct link in the  US in getting cars he bids for online, you arrange shipping and you get a cut.  Or you.  For a partnership where you.  Invest money for shipping and he takes care of the rest, you.  Would be self-reliance soon d and t worry."
conversation_2689.wav, For what it's worth the reason I'm only around when it's time to smoke is that because of gas I can only afford to be around when someone tells me to be and that apparently only happens when somebody wants to light up.
conversation_269.wav, Same.  Want to plan a trip sometime then?
conversation_2690.wav," Hello, my boy toy.  I made it home and my constant thought is of you, my love.  I hope you're having a nice visit but I can't wait till you come home to me, kiss."
conversation_2691.wav," Congrats, Conno, where's the treat mega?"
conversation_2692.wav, Who are you talking about?
conversation_2693.wav, Yup.
conversation_2694.wav, Okay.
conversation_2695.wav," You wake up already?  What are you doing?  You picking us up later right?  I'm taking SQA25, reaching Art 7SMTH8 like that you can check E arrival time.  See ya soon!"
conversation_2696.wav," You need I'm walking in City Link now you faster come down, may very hungry."
conversation_2697.wav, You are yet sure.  Props.
conversation_2699.wav," Hello, who are you?"
conversation_270.wav," Not sure yet, still trying to get a hold of him."
conversation_2700.wav," Hello, how are you?"
conversation_2701.wav," Yes, what is your name?"
conversation_2702.wav," Yes, did the ticket come out?"
conversation_2703.wav, What are you doing?
conversation_2704.wav, Where are you?
conversation_2705.wav, What is eating brother?
conversation_2706.wav," Hello, Mother. What are you doing?"
conversation_2707.wav," Yes Papa, where are you?"
conversation_2708.wav, Hello. How are you?
conversation_272.wav, Theo. I just had to download Flash.  jealous.
conversation_2726.wav," If I had a map, I would give it to her."
conversation_2727.wav," If he tried to blackmail me, I would inform you."
conversation_2728.wav, I wrote a letter day before yesterday.
conversation_2729.wav, He used to smoke 10 cigarettes daily.
conversation_2730.wav, He will go to Delhi on next Monday.
conversation_2731.wav, Suresh will have been teaching in this college for 4 years by the year 2008.
conversation_2732.wav, The students will have left the school before the principal comes.
conversation_2733.wav, He goes for a walk at 6 o'clock daily in the morning.
conversation_2734.wav, It is easy to find faults with others.
conversation_2735.wav, I consider that it is pity to waste time.
conversation_2736.wav, It is uncertain that she will come.
conversation_2737.wav, It is the place where he was murdered.
conversation_2738.wav, I recognize the student to be him.
conversation_2739.wav, Every soldier and every sailor was in his place.
conversation_274.wav," Come to me, we're sorting out our narcotic situation."
conversation_2740.wav, The two friends quarreled with each other.
conversation_2741.wav, He kept himself away from the function.
conversation_2742.wav, This is BBB slash voice of America.
conversation_2743.wav, There is no problem but has a solution.
conversation_2744.wav, We know the hotel that she lives in.
conversation_2745.wav, That is the lady that I told you about.
conversation_2746.wav, This is the house that I told you about.
conversation_2747.wav, He is the most eloquent speaker that I have ever heard.
conversation_2748.wav, There was none that didn't support the cause.
conversation_2749.wav, It is for nothing that I have been trying to find.
conversation_275.wav," Night has ended for another day, morning has come in a special way.  May you smile like the sunny rays and leaves your worries at the blue blue bay."
conversation_2750.wav, I have lost a book that you gave me.
conversation_2751.wav, on easy lies the head that wears a crown.
conversation_2752.wav, What can't be cured must be inviured?
conversation_2753.wav, I know what you want to say.
conversation_2754.wav, What I told you yesterday is a secret.
conversation_2755.wav, I like the boy who helps the poor.
conversation_2756.wav, That is the girl whom all admire.
conversation_2757.wav, The dog whose color is white has become mad.
conversation_2758.wav, I understand the point that you are hinting at.
conversation_2759.wav, Patel was the greatest man that India produced.
conversation_276.wav," Useful I guess, might as well take one car."
conversation_2760.wav, I shall employ them so ever you recommend.
conversation_2761.wav, There was somebody that raised the matty.
conversation_2762.wav, There was not any that could be followed.
conversation_2763.wav, These are Chairman's instruction that must be followed.
conversation_2764.wav, This is a good magazine and which should be read by everyone.
conversation_2765.wav, This is a good car but which is very costly.
conversation_2766.wav, The man whom I met yesterday is very intelligent.
conversation_2767.wav, is you put the seat in your notebook you can refer to it.
conversation_2768.wav, It was I who telephoned you yesterday.
conversation_2769.wav, I am not one of those who cannot keep his promise.
conversation_277.wav, No objection. My boyfriend not coming.
conversation_2770.wav, I could not able of the opportunity one got last year.
conversation_2771.wav, My house is bigger than there.
conversation_2772.wav, This is a secret between you and I.
conversation_2773.wav, Anyone of the two girls can solve this puzzle.
conversation_2774.wav, Either of the three students is responsible for the loss.
conversation_2775.wav, Every man and every woman has his own fascination.
conversation_2776.wav, This is to certify that Mr. A is our employee.
conversation_2777.wav, The boy who is sitting in the corner reads in my class.
conversation_2778.wav, That is the best that you can do.
conversation_2779.wav, Either Rohan or his friends forgot their books.
conversation_278.wav, Thanks.
conversation_2780.wav, She is growing more and more like his father.
conversation_2781.wav, Are you likely ever to become a principal?
conversation_2782.wav, We learn to live happily.
conversation_2783.wav, I have no magazine to read.
conversation_2784.wav, These fruits are delicious to eat.
conversation_2785.wav, It was the best players to be performed that year.
conversation_2786.wav, I ask him where to buy fruits at reasonable rate.
conversation_2787.wav, I showed him which button to press.
conversation_2788.wav, I decided to do it.
conversation_2789.wav," Hello caveat, how are you?  It's been a long time we have met."
conversation_279.wav, Tell Rob to Mac is girlfriend in the theater.
conversation_2790.wav," Oh hi, on guitar. I am doing good. What about you?"
conversation_2791.wav," I am fine too, so where are you working right now?"
conversation_2792.wav, I am working at the Bosch Company.
conversation_2793.wav," Oh, really?  That's a great company.  What is your post there?"
conversation_2794.wav, I am working as a software engineer.
conversation_2795.wav, I am a travel blogger.  I used to travel to different places and explore different cultures and varieties of food  to write it in my blog.  I would like to ask you also to follow my blog.
conversation_2796.wav," Sure, Ankita. I will certainly follow it. You are doing a great job by letting people know about different parts of the world."
conversation_2797.wav," Thanks, Kavya."
conversation_2798.wav," It's going pretty well, but I am facing little difficulties in solving some maths problems."
conversation_2799.wav, Oh really?  May I know which problems they are?  Maybe I could help you with this.
conversation_280.wav," Awesome, I'll see you in a bit."
conversation_2800.wav, It is related to the trigonometry topic.
conversation_2801.wav," Well, fortunately, I really like that topic.  I think we can study together with the whole concept mentioned as per syllabus.  You may come to my house after school to study.  I can even give you some tips to remember the formula's based on this topic."
conversation_2802.wav," We can study together to clear each other doubts.  Also, our parents will not be having any issues with this.  So, let's start it from tomorrow."
conversation_2803.wav, How are you dealing with Delhi's pollution?
conversation_2804.wav," It's really terrifying, especially in Windows.  I recently ordered a Pollution Mask to decrease the effect of Pollution, but we cannot wear it all the time.  But what we need to do at home?"
conversation_2805.wav, You have got a point. I'm also thinking to buy a pollution mask.  What would you suggest?
conversation_2806.wav, What about pollution from fireworks under Wally?
conversation_2807.wav," Any fraudulent act or deception on social media, internet, mobile phones etc. all our cybercrimes."
conversation_2808.wav," But I think he deserved it. He looted as much as 400 rupees, 0-00 from various people."
conversation_2809.wav," There are many types of frauds, blackmailing and threats being done through the phones and internet."
conversation_281.wav, Just send it. So what type of food do you like?
conversation_2810.wav, What acts comes under cybercrimes?
