Filename,Transcription
conversation_10.wav, I had asked you a question some hours before. It's answer.
conversation_101.wav," Okay, where are you?  How did you perform?"
conversation_102.wav, You can call me now.
conversation_103.wav, I am waiting Macon. Call me once you free.
conversation_104.wav, That's cool.  I am a gentlemen and will treat you with dignity and respect.
conversation_105.wav, I like you people's very much.  But I am very shy part.
conversation_106.wav," Does not operate after end LT, hashtag NGT, or what."
conversation_107.wav, It's not the same here.  Still looking for a job.  How much do you earn there?
conversation_108.wav," Sorry, I'll call later."
conversation_109.wav," Okay, did you call me just now?"
conversation_11.wav," Well, I am definitely need to restock before Thanksgiving. I'll let you know when I'm out."
conversation_110.wav," Okay, I am on the way to home."
conversation_111.wav, you will be in the place of that man.
conversation_112.wav, You're up next stop.
conversation_113.wav," I call you later, don't have network.  If urgent, SMS-Me."
conversation_114.wav, for real when you're getting on you.  I only need two more tickets and one more jacket and I'm done.  I already used all my moldies.
conversation_115.wav," Yes, I started to send requests to make it but pain came back so I'm back in bed.  Double coins at the factory too.  I got a cash in all my nitros."
conversation_116.wav, I'm really not up to it still tonight babe.
conversation_117.wav, Come when you are free.
conversation_118.wav, Watching Telegoo Movie. What about you?
conversation_119.wav, I see. When we finish we have loads of loans to pay.
conversation_12.wav," said kiss, kiss, I can't do the sound effects.  He is a gorgeous man isn't he?  Kind of person who needs a smile to brighten his day."
conversation_120.wav, Does that cause problem for you?
conversation_121.wav, I see a cup of coffee animation.
conversation_122.wav, Please don't text me anymore. I have nothing else to say.
conversation_123.wav, Ok name your price as long as it's legal.  When can I pick them up?
conversation_124.wav, I'm still looking for a car to buy.  And have not gone forth driving test yet.
conversation_125.wav, As per your request bail bail has been set as your collar tune for all callers.  Press Asterisk 9 to copy your friend's collar tune.
conversation_126.wav," Wow. You're right. I didn't mean to do that. I guess once I gave up on Boston men and changed my  search location to nice, something changed. Cause on my sign in page it still says Boston."
conversation_127.wav," I'm a my life and Vava, I'm a love you lot dear."
conversation_128.wav, Thanks a lot for your wishes on my birthday.  Thanks you for making my birthday truly memorable.
conversation_129.wav," Alright, I'll hit you up when I get some cash."
conversation_13.wav, Probably gunna swing by in a wee bit.
conversation_130.wav, How would my IP address test that considering my computer isn't a Minecraft server?
conversation_131.wav, I know.  Grumpy old people.  My mom was like you better not be lying.  Then again I am always the one to play jokes.
conversation_132.wav, Don't worry. I guess he's busy.
conversation_133.wav, What is the plural of the noun research?
conversation_134.wav, Going for dinner. Message you after.
conversation_135.wav, I'm okay with it because I like to try new things.  But I scared you done like me.  Because you said not to loud.
conversation_136.wav," Hmm, my uncle just informed me that he's paying the school directly.  So please buy food."
conversation_139.wav, Here is my new address apples and pears and all that milarchy.
conversation_14.wav," Yeah, very nice to be ready on Thursday."
conversation_141.wav, I am going to sound you today.  We'll be done only at 12.
conversation_142.wav, You predict what time you will finish buying.
conversation_143.wav," Good stuff, we'll do."
conversation_144.wav," Just so that you know, Ram hasn't sent money yet.  I just sent her a text not to bother sending.  So it's over, you don't have to involve yourself in anything.  I shouldn't have imposed anything on you in the first place so for that, I apologize."
conversation_145.wav, Are you there in room?
conversation_146.wav, Hey girl. How are you? Hope you are well me and ram our back. Again long time no see.  Give me a call sometime from Lucy.
conversation_147.wav," Okay, how much does it cost?"
conversation_148.wav, I'm home.
conversation_149.wav," Dear, we'll call tomorrow. Please accommodate."
conversation_15.wav, Hello. We have braved the buses and taken on the trains and trived.  I mean we're in B-ham. Have a jolly good rest of week.
conversation_150.wav, First answer my question.
conversation_152.wav, He is there. You call and meet him.
conversation_153.wav," No, no. I will check all rooms before activities."
conversation_154.wav, Got see. I lazy to type. I forgot you in lecture. I saw a pouch but like not very nice.
conversation_155.wav," Okay, text me when you're on the way."
conversation_156.wav," Sir, waiting for your mail."
conversation_157.wav," A sweet thought, never get tired of doing little things for lovable persons because sometimes  those little things occupy the biggest part in their hearts.  Good night."
conversation_158.wav, I know you are. Can you please open the back?
conversation_159.wav," Yes, he ain't not on the dot."
conversation_16.wav," Watching cartoon, listening music and amp, at EVE had to go temple and amp, church.  What about you?"
conversation_160.wav, What's the staff name who is taking class for us?
conversation_1605.wav," OK, yes you will be very busy."
conversation_1606.wav, But thanks a lot for asking me. Maybe next time.
conversation_1607.wav, That's fine. We'll make it next time.
conversation_1608.wav," Why not asking Andrew to go with you?  You live in the same apartment with him, don't you?"
conversation_1609.wav," I have, but he already made an appointment with Lucy.  They plan to play bowling at the leisure center."
conversation_161.wav, I'm a dot will call after check and dot our life will begin from Qatar so please pray very hard.
conversation_1610.wav," I see. Well, I'd be delighted to have you over and join the gathering."
conversation_1611.wav, What a great idea. Thank you.  When should I be there?
conversation_1612.wav, to eat. You drop something.
conversation_1613.wav," Oh, that's my family picture."
conversation_1614.wav, Here you are.
conversation_1615.wav, It looks like you have a big family.
conversation_1616.wav," You're right.  Undoscore Undoscore Undoscore Undoscore Undoscore Undoscore Undoscore Undoscore Undoscore Undoscore Undoscore Undoscore Undoscore Undoscore Undoscore Undoscore Undoscore Undoscore Undoscore Undoscore Undoscore Undoscore Undoscore Undoscore Undoscore My Mother, My Father, My Two Older Brothers, Me, and My Two Younger Sisters."
conversation_1617.wav, I am an only child.
conversation_1618.wav, You are.  How does it feel to be underscore underscore underscore underscore underscore underscore underscore underscore underscore underscore underscore underscore underscore three underscore underscore underscore underscore underscore underscore underscore underscore underscore underscore underscore underscore underscore underscore underscore underscore  Have you ever felt lonely
conversation_1619.wav, I never feel lonely because underscore underscore underscore underscore underscore underscore underscore underscore underscore  For underscore underscore underscore underscore underscore underscore underscore underscore underscore underscore underscore underscore underscore underscore underscore underscore underscore underscore underscore that live nearby  They are like my own brother and sister
conversation_162.wav," Okay, I deleted my contact that why."
conversation_1620.wav, Lucky you. My cousins live in a different city so I rarely meet them.
conversation_1621.wav, You are lucky or than me. You have.
conversation_1622.wav," Ha ha! It is not always like that. We sometimes quibble about trivial things and quarrel  with each other 0.243. Well, at least you still love each other. Toy, this conversation makes me  feel homesick. See you in class, Andrew."
conversation_1623.wav, Will this bus cover the route of the Varka?
conversation_1624.wav," Yes, sir. It's time to get on board."
conversation_1625.wav, Which sector do you want to go?
conversation_1626.wav, Varka Sector 6.
conversation_1627.wav, Is this the same route you cover daily?
conversation_1628.wav, It's 9 o'clock.
conversation_1629.wav, sharp none
conversation_163.wav, Send a good job in Burlassoft.
conversation_1630.wav, Yes. Sometimes due to traffic there is delay of five minutes but more often than not we are on time.
conversation_1631.wav, Every morning at 9 I have to catch a bus for office.  Mostly buses get late so could you please pick me up every day at 9.
conversation_1632.wav, Sure sir. You can also get your monthly pass made for just 200 rupees through which you can travel free for a month.
conversation_1633.wav," Yes, that's perfect. Can I get it made right away?"
conversation_1634.wav," Yes. Of course, sir. I will make it in no time."
conversation_1635.wav, Is there anyone without a ticket?
conversation_1636.wav," Yes, here I am. Give me a ticket, please."
conversation_1637.wav," Sure, where will you go?"
conversation_1638.wav, Please pay 45 rupees for the ticket.
conversation_1639.wav, What? 45 rupees.
conversation_164.wav, The one is flowing and I am nevering.
conversation_1640.wav, But I paid 40 rupees to another bus the day before yesterday for the same distance and route.
conversation_1641.wav, It seems you don't watch TV.  The prices of diesel rose 8 Rupees per liter.  That's why the company has raised the fare to 5 Rupees per every 5 kilometers.
conversation_1642.wav, Oh I see. But show me the new fair menu of the company and show me the notification.
conversation_1643.wav, Here it is pasted behind the seat.
conversation_1644.wav," Okay, nice. Here is your 45 rupees."
conversation_1645.wav, Here is the ticket point 267.  Thanks.  And could you please ask this man to stop smoking?  The smoke is disturbing us.  You follow your company's order of new fears from the very first day but when will you follow your company's  no smoking policy?
conversation_1646.wav," We do follow all policies, sir.  I have already asked two passengers to stop smoking.  They are the people who belong to villages or they are illiterate and hence cannot read the sign saying no smoking."
conversation_1647.wav," Okay, but please make sure that this person sitting beside does not smoke."
conversation_1648.wav," Sure, sir. I am just asking him to quit."
conversation_1649.wav, It's 4 kilometers from here.  We will be there in just 7 to 10 minutes.
conversation_165.wav," Yup, I think Sina is better cost no need to go down to Plaza."
conversation_1650.wav," Have a nice journey, sir."
conversation_1651.wav," Yes, I want to buy some books."
conversation_1652.wav, There are different kinds of books here.  What kind of books you want?
conversation_1653.wav, I want story books for children.
conversation_1654.wav, Have you any particular choice?
conversation_1655.wav," Yes, I want to buy interesting stories about jungles and animals."
conversation_1656.wav, You can see Friends Park and Happy Jungle.
conversation_1657.wav, Are these about animals?
conversation_1658.wav, These are the two best selling books about animal stories.
conversation_1659.wav," Okay, let me see."
conversation_166.wav," OK, your typical reply."
conversation_1660.wav, Here these are. Any other book.
conversation_1661.wav, These are really fun. I was looking for such books.  I would buy these two and also show me a good book on English grammar.
conversation_1662.wav, Is this a perfect book for grammar?
conversation_1663.wav, This is the latest and the most popular book of 2020.  You will find everything written in a simple and easy way.
conversation_1664.wav, We just only have science and fiction books and languages books 0.287.  430 Rupeeser.  I have given you 5% discount.
conversation_1665.wav, Thanks. Here is your payment.
conversation_1666.wav," Well, Dr. I have traveled along distance to consult you. Would you please diagnose my disease?"
conversation_1667.wav, and what may be the matter with you.  You are looking much pulled down.
conversation_1668.wav, I am very ill. I often suffer from a headache. Sometimes I feel that my heart is sinking.
conversation_1669.wav, Let me feel your pulse and see your tongue.  I find nothing wrong with you.  Only your tongue is a bit dirty.
conversation_167.wav," As per your request, Mel Mel has been set as your color tune for all colors.  Press Asterisk 9 to copy your friends' color tune."
conversation_1670.wav, Why? I often suffer from insomnia. My eyesight is also beginning to fail.
conversation_1671.wav," I see, then you must have some bad habits.  You seem to lead a sedentary life.  Is it a fact?"
conversation_1672.wav," No sir, I have no bad habits except smoking.  My life is quite easy and comfortable, I seldom take exercise.  My diet is quite rich consisting of meat, eggs, and fats."
conversation_1673.wav, There you are.  Smoking is very dangerous.  It is the cause of your indigestion which your dirty tongue indicates.  Rich food will do you know good and less you take exercise regularly.
conversation_1674.wav, You suggest no medicine then.
conversation_1675.wav, Should I come again to give you the report?
conversation_1676.wav," Sure, I hope your complaints will have gone till then."
conversation_1677.wav, Goodbye.
conversation_1678.wav," Hello. Actually, I gave a call regarding the network issues."
conversation_1679.wav, Is this the same mobile number on which you are facing network issues?
conversation_168.wav," You are everywhere dirty, on the floor, the windows, even on my shirt.  And sometimes when I open my mouth, you are all that comes flowing out.  I dream of my world without you, then half my chores are out too.  A time of joy for me, lots of TV shows I.L.L.C.  But I guess like all things you just must exist, like rain, hail and mist, and when my  time here is done, you and I become one."
conversation_1680.wav, Could you please confirm your mobile number?
conversation_1681.wav," Yes, sure."
conversation_1682.wav, Your number is 98-432.
conversation_1683.wav," Yes sir, tell me what issues you are facing, 307.  I am facing network issues.  Every time I give a call, there is a call drop after connection.  Sometimes it also takes more than two minutes to connect a call."
conversation_1684.wav," Sir, I would like to tell you that your issues will be resolved.  Could I please know which handset you are using?"
conversation_1685.wav, I am using a Samsung phone.
conversation_1686.wav," I would like to tell you, sir, that you need to change certain settings of your phone because  there is no issue from our end."
conversation_1687.wav, Could you please guide me?
conversation_1688.wav," Sure Sir, I will guide you for that.  Go to your settings, select network, and select 3G if you've chosen 4G because your  sim is not supporting 4G.  That's why you are facing problems while calling."
conversation_1689.wav, What will I have to do to get a 4G sim for the same number?
conversation_169.wav," All right, are you at work?"
conversation_1690.wav, Please visit your nearest store. They will provide you the 4G sim for the same.
conversation_1691.wav," Sir, would you like to know about the new offers?"
conversation_1692.wav," No, thank you."
conversation_1693.wav, Thank you for calling. Have a great day ahead.
conversation_1694.wav," Hello. Actually, my phone is acting up since yesterday morning."
conversation_1695.wav, May I know which headset you are using?
conversation_1696.wav, Apple iPhone 6S Plus.
conversation_1697.wav, Could you please tell me the problems you are facing currently?
conversation_1698.wav, I am facing battery and software issues.
conversation_1699.wav, Can I have a look at your phone?
conversation_17.wav, Do you mind if I ask what happened?  You don't have to say if it is uncomfortable.
conversation_170.wav, I'm leaving my house now.
conversation_1700.wav, Please give me 10 minutes meanwhile have a seat and have coffee 0.325.  Yes sure.
conversation_1701.wav, I have figured out the problem with your phone.  There is a malware in your phone that is apparently responsible for software glitches.  Is your phone under warranty?
conversation_1702.wav," Yes, it is under warranty.  Can it be fixed without extra cost?"
conversation_1703.wav," Yes, definitely, but for that I have to factory reset your phone."
conversation_1704.wav, All my data will be deleted.
conversation_1705.wav," No sir, you can take the backup for all your data.  And if you have already done that then there is no need to fret."
conversation_1706.wav, Actually I haven't done that. Could you please guide me how to take back up the phone data?
conversation_1707.wav, Yes sure. You just need to create an ID on iCloud or you can use your existing Apple ID as well.
conversation_1708.wav, Thank you so much. I need 10 to 15 minutes to do that.
conversation_1709.wav, Done.  How long will it take to fix all the bugs?
conversation_171.wav," Hello, my love.  What are you doing?  Did you get to that interview today?  Are you happy?  Are you being a good boy?  Do you think of me?  Are you missing me?"
conversation_1710.wav, It will take at least an hour.  Kindly show me your bill.
conversation_1711.wav, Sure this is my bill and I will just complete the rest of my work and I will come after an hour to collect my handset.
conversation_1712.wav," Sure, suggest collect your token number from the counter."
conversation_1713.wav, Good.  I want to build a computer that is capable of streaming.  What would be the price for this processor?
conversation_1714.wav," Yes, we do have that product in stock.  May I know your requirement, sir?"
conversation_1715.wav," Hi, do you have this processor?  Intel i71070K."
conversation_1716.wav," Sir, the MRP is INR 33,000, but we have a special discount and we are selling this for INR 29,000."
conversation_1717.wav," Okay, but the price on Amazon seemed to be a little lower.  It was 28,500 the last time I checked."
conversation_1718.wav," Sir, the price on Amazon fluctuates every now and then.  Also, we provide an extended warranty.  You can bring the processor back here if you have any issues with it .344.  That sounds nice.  What is the total warranty you are giving with this product?"
conversation_1719.wav," Sir, we are giving you a one-year standard warranty, plus an additional two years from our side."
conversation_1720.wav," That sounds good, but what is the final price for this?"
conversation_1721.wav," Sir, it is INR 29,000. This is also with extended warranty."
conversation_1722.wav," A small discount would make the deal a little better.  Can you do INR 27,000?"
conversation_1723.wav," Sir, we gain just a small margin with the current MRP.  But for that price, we would be selling it for a loss."
conversation_1724.wav," OK, I will pay 28,500.  I feel that this is a good deal."
conversation_1725.wav," Hmm, sir this is still a loss for us, but we will agree on this price.  Customer satisfaction is our motto."
conversation_1726.wav, Excellent. Please pack that product. And I was also looking to buy a motherboard for my CPU.  Do you have any suggestions? I heard that the Intel Z490 motherboard is a good choice.
conversation_1727.wav," Oh, is it?  How much is the price for that motherboard?"
conversation_1728.wav," This motherboard costs INR 17,000.  But we will give it to you for INR 15,800."
conversation_1729.wav, That sounds wonderful.
conversation_1730.wav," Would you want any other component?  Sure.  Like RAM, SSD, graphics card."
conversation_1731.wav," No, that's enough. I'll take those two for now."
conversation_1732.wav," Thank you, sir. Your total is INR-44300. We accept cash, credit, and debit cards and well as UPI.  How would you like to pay, sir?"
conversation_1733.wav, I will pay with my debit card.
conversation_1734.wav," Thank you for your purchase, sir.  Please do come back if you need any other components or software.  Have a good day."
conversation_1735.wav, Thank you. I will. You too have a good day point 362. I am also fine.  Can we please proceed to the interview?
conversation_1736.wav," Sure, go ahead."
conversation_1737.wav," Sir, your college has made an excellent result in the last HSC exam.  I want to talk to you about the result."
conversation_1738.wav, It's all right.
conversation_1739.wav," Sir, how has your college made such a glorious result this year?"
conversation_174.wav, Keep yourself safe for me because I need you and I miss you already and I envy everyone that sees you in real life.
conversation_1740.wav," To speak the truth, continuous efforts of our teachers and the system of our teaching have helped us to make this result."
conversation_1741.wav, Anything else?  Sir.
conversation_1742.wav, Our good academic environment has also helped us a lot to do this result.  We have a very good relationship between our teachers and guardians.  It has also contributed much to this result.
conversation_1743.wav," It's very good, sir. Most of the students of your college have obtained GPA5 and your college has secured the sixth position in Russia he board.  Isn't it exceptional?"
conversation_1744.wav, You may say so.  Our managing committee keeps a watchful eye on our academic progress.  Our teachers always try to identify the weakness in various subjects of our students  and take necessary steps to overcome it.
conversation_1745.wav," That's very appreciable.  We hope your college will continue doing such glorious result in future.  Thank you for giving me some of your valuable time, sir."
conversation_1746.wav, I would like to know about the incident of the 15th of March.
conversation_1747.wav, I was passing by the Joyanta Hospital and I saw few people fighting with each other.
conversation_1748.wav, Then what did you do after that?
conversation_1749.wav, I stood there for a while and then I decided to move ahead.
conversation_175.wav, New car and house for my parents.I have only new job in hand.
conversation_1750.wav," then what happened next, 378.  Then all of a sudden I heard a sound of a bullet."
conversation_1751.wav, Did you see who fired the bullet?
conversation_1752.wav," Not really, because after that, people started running.  I just have the rough look of that person in my mind."
conversation_1753.wav, Could you please share that man's rough look with us?
conversation_1754.wav, Yes sure. That man was wearing a red shirt with a black cap.
conversation_1755.wav, Did you see his face?
conversation_1756.wav," No, as he was wearing a cap so I couldn't see his face because half of his face was covered with the cap."
conversation_1757.wav, Did you inform the cops?
conversation_1758.wav," Yes, I went to the local police station. They wrote the fur, first information report."
conversation_1759.wav, Thank you so much for sharing this information with us.
conversation_176.wav, I'm so in love with you.  I'm excited each day I spend with you.  You make me so happy.
conversation_1760.wav, So when are we going to see you on the big screen next?
conversation_1761.wav," Soon, I have signed a movie."
conversation_1762.wav, When is the releasing date of that movie?
conversation_1763.wav, It will get released in December.
conversation_1764.wav, Your fans have been eagerly waiting for your movie for quite some time long.
conversation_1765.wav, I really want to thank all my fans for their support.
conversation_1766.wav, We will definitely pass on your message to your fans.  Could you please tell me something about your upcoming movie?
conversation_1767.wav, It's an action plus romantic movie.  I am the main protagonist who portrays a role of an honest police officer who eventually gets trapped by some vinyl politicians.
conversation_1768.wav," Wow, that's interesting point 397.  Ha ha ha.  Let's see how everything pans out."
conversation_1769.wav, and who is the lead actress of this movie.  We would also like to know about her.
conversation_177.wav, I place all your points one culture's module already.
conversation_1770.wav, KanaKak is the lead actress. She is playing a role of a politician's daughter.  AHH that's enough of the information about the movie I guess.  Let's keep something for the trailer as well.
conversation_1771.wav," Yes, we totally agree.  We all are really excited to see the trailers of your upcoming movie."
conversation_1772.wav, Your Internet Explorer browser and computer may be compromised by security threats.  Call 844-335-2291 now for immediate assistance.
conversation_1773.wav, PLS PLS find out from AntNugging.
conversation_1774.wav," Wow. I love you so much, you know. I can barely stand it. I wonder how your day goes and if you are well, my love. I think of you and Miss you."
conversation_1775.wav, No screaming means shouting.
conversation_1776.wav, Hey what happened to? Are you all right?
conversation_1777.wav, Should I have picked up a receipt or something earlier?
conversation_1778.wav, I think Chennai well settled.
conversation_1779.wav, O-Dang. I didn't mean O-Send that to you.  LOL.
conversation_178.wav," Hi friend, which is best way to avoid misunderstanding with our beloved ones."
conversation_1780.wav," Unfortunately, I've just found out that we have to pick my sister up from the airport that evening so don't think I'll be going out at all.  We should try to go out one of TH."
conversation_1781.wav, Horrible BF. I now V-Hungry.
